{
  "schema_version": "aicx.slack_thread_poll_receipt.v0",
  "poll_receipt_id": "SLACKTHREADPOLL-QUIZ-ASB-2026-06-21-DRY-RUN",
  "quiz_set_id": "QUIZ-ASB-2026-06-21",
  "generated_for_date": "2026-06-21",
  "delivery_channel": "slack",
  "mode": "dry-run",
  "status": "reply_found_graded_and_sent",
  "thread_poll_used": false,
  "slack_used": false,
  "target_channel_env": "SLACK_CHANNEL_ID",
  "started_at_unix_seconds": 1782096366,
  "completed_at_unix_seconds": 1782096366,
  "env_readiness": {
    "bot_token_present": false,
    "channel_id_present": false,
    "slack_sdk_available": false,
    "required_env": [
      "SLACK_BOT_TOKEN",
      "SLACK_CHANNEL_ID"
    ],
    "missing_env": [
      "SLACK_BOT_TOKEN",
      "SLACK_CHANNEL_ID"
    ]
  },
  "channel_id": "C_FIXTURE",
  "thread_ts": "1782074738.865009",
  "message_count": 3,
  "candidate_reply_count": 1,
  "received_reply_event_id": "SLACKREPLY-QUIZ-ASB-2026-06-21-EV-QUIZ-ASB-2026-06-21-FIXTURE",
  "grading_response_id": "SLACKGRADING-QUIZ-ASB-2026-06-21",
  "slack_response": null,
  "errors": []
}
